{
  "contract_version": "1.0",
  "status": "succeeded",
  "mode": "dry_run",
  "started_at": "2026-08-26T10:00:00Z",
  "finished_at": "2026-08-26T10:00:01Z",
  "task_id": "crawl-data-gov-my-test",
  "run_id": "data-gov-my:trade_sitc_1d:20260826T100001Z",
  "idempotency_key": "SRC-MY-DATAGOV:trade_sitc_1d:sha256:aaaaaaaaaaaaaaaaaaaaaaaaaaaaaaaaaaaaaaaaaaaaaaaaaaaaaaaaaaaaaaaa",
  "source_id": "SRC-MY-DATAGOV",
  "source_status": "trial",
  "source_crawl_status": "approved_trial",
  "dataset_id": "trade_sitc_1d",
  "url": "https://api.data.gov.my/data-catalogue?id=trade_sitc_1d&limit=10&sort=-date",
  "crawled_at": "2026-08-26T10:00:01Z",
  "content_hash": "sha256:aaaaaaaaaaaaaaaaaaaaaaaaaaaaaaaaaaaaaaaaaaaaaaaaaaaaaaaaaaaaaaaa",
  "record_count": 10,
  "byte_count": 2048,
  "collection_relevance": "high",
  "verification_hint": "F4",
  "publication_status": "staged",
  "checked_source_count": 1,
  "success_count": 1,
  "failure_count": 0,
  "skipped_count": 0,
  "submitted_count": 0
}
